NEP,NEP REALTY AND INDUSTRY PUBLIC COMPANY LIMITED,SET,Industrials,Packaging,"41 Soi Phaholyothin 5, Phaholyothin Road, Phayathai, Phayathai Bangkok",10400,0-2271-4213-16,0-2271-4416,www.nep.co.th
NER,NORTH EAST RUBBER PUBLIC COMPANY LIMITED,SET,Agro & Food Industry,Agribusiness,398 Moo. 4 Kokma Subdistrict Prakhonchai District Buriram,31140,"0-4466-6928, 0-4466-6929","0-4466-6212, 0-4466-6213",http://www.nerubber.com
NETBAY,NETBAY PUBLIC COMPANY LIMITED,mai,Technology,-,"No. 719/5,8-9 Rama 6 Road, Wang mai, Pathumwan Bangkok",10330,0-2620-1800,0-2612-3051,http://www.netbay.co.th
NEW,WATTANA KARNPAET PUBLIC COMPANY LIMITED,SET,Services,Health Care Services,"70/7-8 SUPHAKITJANYA ROAD, MAKKHAENG,AMPHOE MUANG Udon Thani",41000,"0-4224-1031-3, 0-4224-6181-3",0-4224-1956,www.wattanahospital.net
NEWS,NEWS NETWORK CORPORATION PUBLIC COMPANY LIMITED,mai,Services,-,"944 Mitrtown Office Tower, 28th Floor, Units 2807-2810, Rama 4 Road, Wangmai, Pathumwan Bangkok",10330,0-2273-8351,0-2273-8359,www.newsnetwork.co.th
NEX,NEX POINT PUBLIC COMPANY LIMITED,SET,Industrials,Automotive,"999/999 Moo 4 Bangchalong, Bang Phli Samut Prakarn",10540,0-2026-3599,0-2116-4878,www.nexpoint.co.th
NFC,NFC PUBLIC COMPANY LIMITED,SET,Industrials,Petrochemicals & Chemicals,"88 SC Group Building, 3rd Floor, The Parkland Rd., Bangna Nuea, Bangna Bangkok",10260,0-2348-0580-6,0-2348-0578-9,www.nfc.co.th
NKI,THE NAVAKIJ INSURANCE PUBLIC COMPANY LIMITED,SET,Financials,Insurance,"SATHON THANI COMPLEX, FL 26-27, 100/50-55, 90/4-6 NORTH SATHON ROAD, SILOM, BANG RAK Bangkok",10500,"0-2636-7900 , 0-2238-5058","0-2636-7999, 0-2636-7998",www.navakij.co.th
NKT,Nakornthon Hospital Public Company Limited,SET,Services,Health Care Services,"1 Soi Rama II, Soi 56, Samaedum, Bangkhunthain Bangkok",10150,"0-2450-9999,0-2000-9999",0-2415-4340,www.nakornthon.com
NL,NL Development Public Company Limited,SET,Property & Construction,Construction Services,"417 Ratchawithi Road, Bang Plat, Bang Plat Bangkok",10700,0-2435-1054,0-2879-2495,www.nldplc.com
NNCL,NAVANAKORN PUBLIC COMPANY LIMITED,SET,Property & Construction,Property Development,"999 Moo 13, Phaholyothin Road, Klong Nueng, Klong Luang Pathum Thani",12120,0-2529-0031-5,0-2529-2176,www.navanakorn.co.th
NOBLE,NOBLE DEVELOPMENT PUBLIC COMPANY LIMITED,SET,Property & Construction,Property Development,"NOBLE Building, 1035 Ploenchit Road, Lumpini, Pathumwan Bangkok",10330,0-2251-9955,0-2251-9977,www.noblehome.com
NOVA,NOVA EMPIRE PUBLIC COMPANY LIMITED,SET,Resources,Energy & Utilities,"No. 88 Soi Bangna-Trad 30, Theprattana Road, Bangna Tai, Bangna Bangkok",10260,-,-,https://www.novaempire.co.th
NPK,NEW PLUS KNITTING PUBLIC COMPANY LIMITED,mai,Consumer Products,-,"34 Moo 20 Suvintawong Road, Saladang, Bangnumpeaw Chacherngsao",24000,"0-3859-3129-30 , 0-3859-3133",0-3884-6040,https://www.newplus.co.th/
NRF,NR INSTANT PRODUCE PUBLIC COMPANY LIMITED,SET,Agro & Food Industry,Food & Beverage,"No. 99/1 Moo 4, Kaerai, Krathumbaen Samut Sakhon",74110,0-3484-9576-80,0-3484-9586,https://www.nrinstant.com/
NSL,NSL FOODS PUBLIC COMPANY LIMITED,SET,Agro & Food Industry,Food & Beverage,"55/22 Moo 3, Bangbuathong-Nonthaburi Bridge (345) Road, Tambol Lampho, Ampher Bang bua thong Nonthaburi",11110,0-2525-8520,0-2525-8538,www.nslfoods.com
NTSC,Nutrition SC Public Company Limited,mai,Agro & Food Industry,-,"47/2 Moo 6, Phutthamonthon Sai 4 Road, Krathum Lom, Sam Phran Nakorn Phathom",73220,0-2840-4333,-,https://nutritionsc.co.th
NTV,NONTHAVEJ HOSPITAL PUBLIC COMPANY LIMITED,SET,Services,Health Care Services,"432 NGAMWONGWAN ROAD, BANGKHEN, AMPHOE MUANG Nonthaburi",11000,0-2596-7888,0-2589-8753,www.nonthavej.co.th
NUT,NUTRITION PROFESS PUBLIC COMPANY LIMITED,mai,Consumer Products,-,"1, 2 Chatu Chot 14 Soi Wat Khok Chala, Sai Mai Road, O Ngoen Sub-district/Sub-area, Sai Mai District/Area Bangkok",10220,0-2022-9400,0-2022-9401,https://www.nutritionprofess.com/th
NV,NOVA ORGANIC PUBLIC COMPANY LIMITED,SET,Consumer Products,Personal Products & Pharmaceuticals,"Nai Khlong Bang Plakot Sub Dist Rd., Tumbol Nai Khlong Bang Plakot, Amphoe Phra Samut Chedi Samut Prakarn",10290,0-2408-6778,0-2408-6778,https://www.nova-organic.com
NVD,NIRVANA DEVELOPMENT PUBLIC COMPANY LIMITED,SET,Property & Construction,Property Development,"No.343/351 Prasert - Manukitch Rd., Nuanchan, Buengkum Bangkok",10230,0-2105-6789,0-2105-6787,https://www.nirvanadevelopment.co.th
NWR,NAWARAT PATANAKARN PUBLIC COMPANY LIMITED,SET,Property & Construction,Construction Services,"BANGNA TOWER A, 2/3 MOO 14, BANGNA-TRAD ROAD, K.M. 6.5, TAMBOL BANGKAEW, AMPHOE BANGPLEE Samut Prakarn",10540,"0-2730-2100, 0-2751-9455-74","0-2751-9487, 0-2751-9484-5",www.nawarat.co.th
NYT,NAMYONG TERMINAL PUBLIC COMPANY LIMITED,SET,Services,Transportation & Logistics,"19th Floor Lumpini Tower (Room No. 1168/52) Rama 4 Road, Thungmahamek, Sathorn Bangkok",10120,0-2679-7357,0-2285-6642,www.namyongterminal.com
OCC,O.C.C. PUBLIC COMPANY LIMITED,SET,Consumer Products,Personal Products & Pharmaceuticals,"729/4-7 RAJADAPISEK ROAD, BANGPHONGPHANG, YAN NAWA Bangkok",10120,"0-2295-4545, 0-2295-4567",0-2295-0415,www.occ.co.th
OGC,OCEAN GLASS PUBLIC COMPANY LIMITED,SET,Consumer Products,Home & Office Products,"75/88-90, 34th Floor, Ocean Tower II, Sukhumvit 19 (Soi Wattana), North-Klongtoey, Wattana Bangkok",10110,0-2661-6556,0-2661-6550,http://www.oceanglass.com
OHTL,OHTL PUBLIC COMPANY LIMITED,SET,Services,Tourism & Leisure,"48 ORIENTAL AVENVE, NEW ROAD, BANG RAK, Bangkok",10500,0-2659-9000,0-2659-0000,https://www.mandarinoriental.com/en/bangkok
OKJ,Pluk Phak Praw Rak Mae Public Company Limited,SET,Agro & Food Industry,Food & Beverage,"411, Moo 2, Nong Chom, San Sai Chiang Mai",50210,0-5208-0744,-,www.okjgroup.com
ONEE,THE ONE ENTERPRISE PUBLIC COMPANY LIMITED,SET,Services,Media & Publishing,"Gmm Grammy Place Bldg. Sukhumvit 21 (Asok) Rd., Khlong Toei Nuea, Vadhana Bangkok",10110,0-2669-9697,-,www.theoneenterprise.com
ONSENS,Onsen Retreat and Spa Group Public Company Limited,SET,Services,Tourism & Leisure,"120/5 Soi Sukhumvit 26, Khlong Tan Sub-district/Sub-area, Khlong Toei District/Area Bangkok",10110,0-2024-8595,-,www.onsengroup.co.th
OR,PTT OIL AND RETAIL BUSINESS PUBLIC COMPANY LIMITED,SET,Resources,Energy & Utilities,"555/2 Energy Complex, Building B, 12th Floor, Vibhavadi Rangsit Road, Chatuchak, Chatuchak Bangkok",10900,0-2196-5959,-,www.pttor.com
ORI,ORIGIN PROPERTY PUBLIC COMPANY LIMITED,SET,Property & Construction,Property Development,"496 Moo.9 Samrong Nuae District, Muaeng Samutprakarn Samut Prakarn",10270,0-2030-0000,0-2029-1939,https://origin.co.th/
ORN,ORNSIRIN HOLDING PUBLIC COMPANY LIMITED,SET,Property & Construction,Property Development,"79 Moo 8, San Pu Loei Subdistrict, Doi Saket District Chiang Mai",50220,0-5333-3666,-,https://www.ornsirin.co.th
OSP,OSOTSPA PUBLIC COMPANY LIMITED,SET,Agro & Food Industry,Food & Beverage,"348 Ramkhamhaeng Road Hua Mak, Bang Kapi Bangkok",10240,0-2351-1000,0-2351-1125,www.osotspa.com
PACO,PRESIDENT AUTOMOBILE INDUSTRIES PUBLIC COMPANY LIMITED,mai,Industrial,-,"88/8 Moo.9, Soi WorPorAor.11(Piset), Satetakit 1 Road, Suanluang, Krathum Baen Samut Sakhon",74110,0-2810-9900,"0-2810-0526-8 ext. 321, 307",www.paco.co.th
PAF,PAN ASIA FOOTWEAR PUBLIC COMPANY LIMITED,SET,Consumer Products,Fashion,No. 507/2 Moo 11 Nongkham Sriracha Chonburi,20230,0-3848-0020,-,http://www.panasiafootwear.com
PANEL,PanelesMatic Solutions Public Company Limited,mai,Property & Construction,-,"36 Moo 7, Bang Talat, Pak Kret Nonthaburi",11120,"0-2965-5578-80,82-84 Ext.312",0-2965-5584,www.panelesmatic.com
PAP,PACIFIC PIPE PUBLIC COMPANY LIMITED,SET,Industrials,Steel and Metal Products,"LUMPINI TOWER, FLOOR 26, 1168/74 RAMA IV ROAD Bangkok",10120,0-2679-9000,0-2679-9075,http://www.pacificpipe.co.th
PATO,PATO CHEMICAL INDUSTRY PUBLIC COMPANY LIMITED,SET,Industrials,Petrochemicals & Chemicals,"3388 NEW PETCHBURI ROAD, BANG KAPI, HUAI KHWANG Bangkok",10310,"0-2318-5612-19, 0-2318-0360-9",0-2318-0367,www.patochemical.com
PB,PRESIDENT BAKERY PUBLIC COMPANY LIMITED,SET,Agro & Food Industry,Food & Beverage,"RS TOWER, FLOOR 29, 121/84-85 RATCHADAPISEK ROAD, DIN DAENG Bangkok",10400,02-209-3000,02-209-3091,http://www.farmhouse.co.th
PCC,Precise Corporation Public Company Limited,SET,Industrials,Industrial Materials & Machinery,"1842 Krungthep-Nonthaburi Road, Wongsawang, Bangsue Bangkok",10800,02-910-9700,-,http://www.precise.co.th
PCE,PETCHSRIVICHAI ENTERPRISE PUBLIC COMPANY LIMITED,SET,Agro & Food Industry,Agribusiness,"99/19 Moo 4 Kanchanawithi Road, Bangkung, Muang Surat Thani Surat Thani",84000,0-7728-4917-9,-,https://www.pce-th.com
PCSGH,P.C.S. MACHINE GROUP HOLDING PUBLIC COMPANY LIMITED,SET,Industrials,Automotive,"No. 2/1-9, Moo 3, Kokgroad Sub-district, Muang Nakorn-Rajsima District Nakhon Ratchasima",30000,0-4470-1300,0-4470-1399,www.pcsgh.com
PDG,PRODIGY PUBLIC COMPANY LIMITED,mai,Industrial,-,"7/3 Moo 3 Bangkrabau, Nakornchaisri Nakorn Phathom",73120,0-3433-2611-2,0-3433-2613,www.prodigy.co.th
PDJ,PRANDA JEWELRY PUBLIC COMPANY LIMITED,SET,Consumer Products,Fashion,28 Soi Bangna-Trade 28 Bangna Tai Bangna Bangkok,10260,"0-2769-9999, 0-2361-3311","0-2398-2143, 0-2399-4874",www.pranda.com
PEACE,PEACE & LIVING PUBLIC COMPANY LIMITED,SET,Property & Construction,Property Development,"231/14 Soi Ekamai 7, Sukhumwit 63 Road, Klong Tan Nua Sub-District, Wattana District Bangkok",10110,0-2392-1066-8,-,http://www.peaceandliving.co.th
PEER,PEER FOR YOU PUBLIC COMPANY LIMITED,mai,Services,-,"No. 944 Mitrtown Office Tower, 28th Floor, Units 2807-2810, Rama 4 Road, Wangmai, Pathumwan Bangkok",10330,-,-,www.peerforyou.co.th
PERM,PERMSIN STEEL WORKS PUBLIC COMPANY LIMITED,SET,Industrials,Steel and Metal Products,"4, 95-96 Moo 6, Tumbol Khok-kam, Amphur Muang Samut Sakhon",74000,0-3482-5090-100,"0-3482-5078, 0-3482-5079, 0-3482-5081",www.permsin.com
PF,PROPERTY PERFECT PUBLIC COMPANY LIMITED,SET,Property & Construction,Property Development,"VORASOMBAT BLDG, FLOOR 17, 100/1 RAMA IX RD, HUAI KHWANG Bangkok",10320,0-2245-6640-7,0-2247-3328,www.pf.co.th
PG,PEOPLE'S GARMENT PUBLIC COMPANY LIMITED,SET,Consumer Products,Fashion,"666 RAMA III ROAD, BANGPHONGPHANG, YAN NAWA Bangkok",10120,0-2685-6500,0-2294-5159,www.pg.co.th
PHG,Patrangsit Healthcare Group Public Company Limited,SET,Services,Health Care Services,"733/345 and 733/359 mhoo 8, Phahonyothin Road, Khu Khot, Lam Luk Ka District Pathum Thani",12130,0-2998-9999,-,www.patrangsit.com
PHOL,PHOL DHANYA PUBLIC COMPANY LIMITED,mai,Industrial,-,"1/11 Moo 3, Lumlookka Rd., Ladsawai, Lumlookka Pathum Thani",12150,0-2791-0111,0-2791-0100-2,http://www.pdgth.com
PICO,PICO (THAILAND) PUBLIC COMPANY LIMITED,mai,Services,-,"10 SOI LASALLE 56, BANGNA TAI, BANGNA Bangkok",10260,0-2748-7007,"0-2745-8521, 0-2748-7591",https://www.picothai.com
PIMO,PIONEER MOTOR PUBLIC COMPANY LIMITED,mai,Industrial,-,"78, 78/4, 78/5 Moo3 Dontoom-Nakornchaisri Rd., Donfaek, Nakornchaisri Nakorn Phathom",73120,0-3426-5111-8,0-3426-5119,www.pioneermotor.th.com
PIN,PINTHONG INDUSTRIAL PARK PUBLIC COMPANY LIMITED,SET,Property & Construction,Property Development,"No. 789, Moo1, Sai NongKhor-Laem Chabang Road, Nong Kham, Sriracha Chonburi",20230,0-2294-0066 Ext. 291,-,https://www.pinthongindustrial.com/
PIS,Pro Inside Public Company Limited,mai,Technology,-,"55 Din Daeng Sub-district/Sub-area, Din Daeng District/Area Bangkok",10400,0-2029-7875,0-2029-7879,www.proinside.co.th
PJW,PANJAWATTANA PLASTIC PUBLIC COMPANY LIMITED,SET,Industrials,Packaging,"No. 19 and 21 Soi Ekkachai 63, Ekkachai Road, Bang Bon Sub-district, Bang Bon District Bangkok",10150,0-2415-1894,0-2415-0951,www.pjw.co.th
PK,PATKOL PUBLIC COMPANY LIMITED,SET,Industrials,Industrial Materials & Machinery,"348 CHELERMPRAKIAT RAMA 9 ROAD, NOGBON, PRAWET Bangkok",10250,0-2328-1032-49,-,www.patkol.com
PL,PHATRA LEASING PUBLIC COMPANY LIMITED,SET,Financials,Finance & Securities,"MUANGTHAI-PHATRA COMPLEX, FLOOR 29, 252/6 RAJADAPISEK ROAD, HUAI KHWANG, Bangkok",10320,0-2693-2288,0-2693-2298-99,www.pl.co.th
PLANB,PLAN B MEDIA PUBLIC COMPANY LIMITED,SET,Services,Media & Publishing,"No. 1700, Plan B Tower, New Petchburi Road, Makkasan, Ratchathewi Bangkok",10400,0-2530-8053-6,0-2530-8057,www.planbmedia.co.th
PLANET,PLANET COMMUNICATIONS ASIA PUBLIC COMPANY LIMITED,mai,Technology,-,"157 Soi Ramindra 34, Ramindra Road, Tarang, Bangkhen Bangkok",10230,0-2792-2400,0-2792-2499,www.planetcomm.com
PLAT,THE PLATINUM GROUP PUBLIC COMPANY LIMITED,SET,Property & Construction,Property Development,"no.222/1398, floor 11, the Platinum Fashion Mall Building, Petchaburi Road, Petchaburi Road Sub-District, Ratchatewi District Bangkok",10400,0-2121-9999,0-2121-9000,http://theplatinumgroup.co.th
PLE,POWER LINE ENGINEERING PUBLIC COMPANY LIMITED,SET,Property & Construction,Construction Services,"2 SOI SUKHUMVIT 81 (SIRIPOT), SUKHUMVIT ROAD BANGJAK, PHRA KHANONG Bangkok",10260,0-2332-0345,0-2311-0851,http://www.ple.co.th
PLT,Pilatus Marine Public Company Limited,mai,Services,-,"84/1-4 Young Place Grand Le Jardin 1st?4th Floor, Soi Phahon Yothin 37, Lat Yao, Chatuchak Bangkok",10900,0-2930-1801-10,0-2512-2365,www.pilatusmarine.co.th
PLUS,Royal Plus Public Company Limited,SET,Agro & Food Industry,Food & Beverage,"84/3-7 Soi. Rama II Soi 69 Samae Dam, Bang Khun Thian Bangkok",10150,0-2416-9209,0-2416-0219,www.royalplus.co.th
PM,PREMIER MARKETING PUBLIC COMPANY LIMITED,SET,Agro & Food Industry,Food & Beverage,"No. 1 Premier Corporate Park, Soi Premier 2, Srinakarin Road, Nongbon Sub-district, Prawet District Bangkok",10250,0-2301-1000,0-2301-1020,www.premier-marketing.co.th
PMC,PMC Label Materials Public Company Limited,mai,Industrial,-,"30/28 Moo.2, Koke-Kham Subdistrict, Mueng District Samut Sakhon",74000,0-3445-2000,-,www.pmclabel.com
PMTA,PM THORESEN ASIA HOLDINGS PUBLIC COMPANY LIMITED,SET,Industrials,Petrochemicals & Chemicals,"26/26-27 Orakarn Building, 8th Floor, Soi Chidlom, Ploenchit Road, Lumpini, Pathumwan Bangkok",10330,0-2250-0569,0-2657-1040,http://www.pmthoresenasia.com
POLY,Polynet Public Company Limited,SET,Industrials,Automotive,888 Moo. 11 Bangsaotong District Samut Prakarn,10570,0-2397-9094,0-2397-9097,https://www.polynet.co.th
POPF,PRIME OFFICE LEASEHOLD PROPERTY FUND,SET,Property & Construction,Property Fund & REITs,"7-8th Floor, SCB Park Plaza 1, 18 Ratchadapisek Rd., Chatuchak Bangkok",10900,0-2949-1500,0-2949-1501,www.scbam.com
PORT,SAHATHAI TERMINAL PUBLIC COMPANY LIMITED,SET,Services,Transportation & Logistics,"51/1 Moo.3, Poo Jao Saming Prai Rd., Prapadaeng Samut Prakarn",10130,0-2386-8000,0-2386-8008,http://sahathaiterminal.com/
PPM,PORN PROM METAL PUBLIC COMPANY LIMITED,mai,Industrial,-,"205/1 Nakhonratchasima Road, Dusit, Dusit Bangkok",10300,0-2628-6100,0-2628-6006,www.ppm.co.th
PPP,PREMIER PRODUCTS PUBLIC COMPANY LIMITED,SET,Property & Construction,Construction Materials,"2 Premier Place Soi Premier 2 Srinakarin Road, Nong Bon Pravet Bangkok",10250,"0-2301-2100, 0-2301-2101",0-2398-1301,www.premier-products.co.th
PPPM,PP PRIME PUBLIC COMPANY LIMITED,SET,Agro & Food Industry,Agribusiness,"62-62/1 Moo 2 Rorporchor U-tapao Road, Nong Chumphon Subdistrict, Khao Yoi District Phetchaburi",76140,0-3289-9881-4,0-3289-9885,https://www.ppprime.co.th/
PPS,PROJECT PLANNING SERVICE PUBLIC COMPANY LIMITED,mai,Property & Construction,-,"381/6 Soi Rama IX 58 (Soi 7 Seree 7), Rama IX Road, Suanluang Bangkok",10250,0-2718-2785-9,0-2300-5545-6,www.pps.co.th
PQS,Premier Quality Starch Public Company Limited,SET,Agro & Food Industry,Food & Beverage,"185 Moo. 14, Kham Pa Lai, Mueang Mukdahan Mukdahan",49000,0-4264-3818,0-4264-3819,https://www.pqstarch.com
PR9,PRARAM 9 HOSPITAL PUBLIC COMPANY LIMITED,SET,Services,Health Care Services,"99 Rama IX Road, Bang Kapi, Huaykwang Bangkok",10310,0-2202-9999,0-2202-9998,http://www.praram9.com
PRAKIT,PRAKIT HOLDINGS PUBLIC COMPANY LIMITED,SET,Services,Media & Publishing,"88 SOI SUKHUMVIT 62 SECTION 3, PHRA KHANONG TAI, PHRA KHANONG Bangkok",10260,0-2332-8555,"0-2332-8522, 0-2332-8544",http://www.prakit.com
PRAPAT,PEERAPAT TECHNOLOGY PUBLIC COMPANY LIMITED,mai,Industrial,-,"406 Ratchadaphisek Road, Samsen Nok, Huai Khwang Bangkok",10310,0-2290-1234,0-2290-1249,https://www.peerapat.com
PREB,PRE-BUILT PUBLIC COMPANY LIMITED,SET,Property & Construction,Construction Services,"503 Floor 1 Bond Street Road, Bangpood, Pakkred Nonthaburi",11120,0-2960-1380-89,0-2960-1392,www.prebuilt.co.th
PRECHA,PREECHA GROUP PUBLIC COMPANY LIMITED,SET,Property & Construction,Property Development,"1919 PATTANAKARN ROAD, SUAN LUANG Bangkok",10250,0-2722-8855,0-2722-8844,www.preecha.com
PRG,PRG CORPORATION PUBLIC COMPANY LIMITED,SET,Agro & Food Industry,Food & Beverage,"88 MOO 2, TIWANONT ROAD, BANGKADEE, AMPHOE MUENG Pathum Thani",12000,0-2501-2175,0-2501-2176,www.prg.co.th
PRI,Primo Service Solutions Public Company Limited,mai,Property & Construction,-,"No. 496, Moo 9, Soi Baering 16, Tambon Sam Rong Nua, Amphoe Mueang Samut Prakan Samut Prakarn",10270,0-2081-0000,-,www.primo.co.th
PRIME,PRIME ROAD POWER PUBLIC COMPANY LIMITED,SET,Resources,Energy & Utilities,"No. 1, TP&T Tower, 22nd Floor, Soi Vibhavadi Rangsit 19, Vibhavadi Rangsit Road, Chatuchak, Chatuchak Bangkok",10900,0-2105-8686,0-2257-7006,www.primeroadpower.com
PRIN,PRINSIRI PUBLIC COMPANY LIMITED,SET,Property & Construction,Property Development,"246 Watcharapon Road, Tha Raeng, Bangkhen Bangkok",10220,0-2022-8988,-,http://www.prinsiri.com
PRINC,PRINCIPAL CAPITAL PUBLIC COMPANY LIMITED,SET,Services,Health Care Services,"23rd Floor, Bangkok Business Center, 29 Sukhumvit 63, Klongton Nua, Wattana Bangkok",10110,0-2714-2171-3,0-2714-2185,www.principalcapital.co.th
PRM,PRIMA MARINE PUBLIC COMPANY LIMITED,SET,Services,Transportation & Logistics,"No. 80 Soi Bangna-Trad 30, Bangna Tai Sub-district, Bangna District Bangkok",10260,0-2016-0190-4,0-2016-0199,www.primamarine.co.th
PROEN,PROEN CORP PUBLIC COMPANY LIMITED,mai,Technology,-,"72 NT Bangrak Building 4th, 18th Fl., Charoen Krung Road, Bangrak, Bangrak Bangkok",10500,"0-2690-3888, 0-2639-7888","0-2639-7892, 0-2691-1898",https://www.proen.co.th/
PROS,PROSPER ENGINEERING PUBLIC COMPANY LIMITED,mai,Property & Construction,-,"11 Soi Nakniwat 20, Nakniwat Road, Ladphrao Bangkok",10230,0-2514-3113,-,www.prosperengineering.co.th
PROSPECT,PROSPECT LOGISTICS AND INDUSTRIAL FREEHOLD AND LEASEHOLD REAL ESTATE INVESTMENT TRUST,SET,Property & Construction,Property Fund & REITs,"No. 345, 345 Surawong Building, 5th Floor, Surawong Road, Suriyawong, Bangrak Bangkok",10500,0-2697-3788,0-2697-3794,www.prospectreit.com
PROUD,PROUD REAL ESTATE PUBLIC COMPANY LIMITED,SET,Property & Construction,Property Development,"No. 548, One City Centre, 19th Floor, Unit. No. 1902-1903, Ploenchit Road, Lumpini Subdistrict, Pathumwan District Bangkok",10330,0-2035-0999,0-2035-0998,www.proudrealestate.co.th
PRTR,PRTR Group Public Company Limited,SET,Services,Professional Services,"2034/82 Ital-Thai Tower, 18th Floor, New Petchburi Road, Bangkapi, Huaykwang Bangkok",10310,0-2716-0000,-,https://www.prtr.com/
PSGC,PSG CORPORATION PUBLIC COMPANY LIMITED,mai,Property & Construction,-,"11/1 AIA Sathorn Tower, 9th Floor, South Sathorn Road, Yannawa, Sathorn Bangkok",10120,0-2018-7190-8,0-2018-7199,www.psgcorp.co.th
PSH,PRUKSA HOLDING PUBLIC COMPANY LIMITED,SET,Property & Construction,Property Development,"1177, Pearl Bangkok Building, Phahonyothin Road, Phayathai Sub-District, Phayathai District Bangkok",10400,0-2080-1739,0-2080-1700,http://www.psh.co.th
PSL,PRECIOUS SHIPPING PUBLIC COMPANY LIMITED,SET,Services,Transportation & Logistics,"No. 8, North Sathorn Road, G, 7th, 8th and 9th floors, Silom, Bangrak Bangkok",10500,0-2696-8800,"0-2236-7654, 0-2633-8460",www.preciousshipping.com
PSP,P.S.P.Specialties Public Company Limited,SET,Industrials,Industrial Materials & Machinery,"1 Borommaratchachonnani Rd. Arun Amarin, Bangkok Noi Bangkok",10700,0-2434-0540,0-2433-6016,www.psp.co.th
PSTC,POWER SOLUTION TECHNOLOGIES PUBLIC COMPANY LIMITED,mai,Resources,-,"No.389 PSTC Building, Vibhavadi Rangsit Road, Samsen Nai Subdistrict, Phaya Thai District Bangkok",10400,0-2526-9999,0-2408-6235,http://www.pst.co.th
PT,PREMIER TECHNOLOGY PUBLIC COMPANY LIMITED,SET,Technology,Information & Communication Technology,"PREMIER CORPORATE PARK BUILDING, 1 SOI PREMIER 2, SRINAKARIN ROAD, NONGBON, PRAWET Bangkok",10250,"0-2301-1000,0-2301-1550",0-2398-2816,www.premier-technology.co.th
PTC,PREMIER TANK CORPORATION PUBLIC COMPANY LIMITED,mai,Resources,-,"No. 2034/69 Italthai Tower, 15th Floor, New Petchburi Road, Bangkapi, Huai Khwang Bangkok",10310,0-2318-4013,0-2318-4014,www.premiertankcorp.com
PTECH,PLUS TECH INNOVATION PUBLIC COMPANY LIMITED,SET,Services,Media & Publishing,"41/1 SOI WATSUANSOM, PUCHAOSAMINGPHRAI ROAD, PHRA PRADAENG Samut Prakarn",10130,"0-2394-4374-5, 0-2754-2650",0-2384-0917,www.plustech.co.th
PTG,PTG ENERGY PUBLIC COMPANY LIMITED,SET,Resources,Energy & Utilities,"90 CW Tower A (33rd), Ratchadaphisek Road, Huaykwang Bangkok",10310,"0-2168-3377, 0-2168-3388","0-2168-3379, 0-2168-3389",www.ptgenergy.co.th
PTL,POLYPLEX (THAILAND) PUBLIC COMPANY LIMITED,SET,Industrials,Packaging,"OCEAN TOWER II, FLOOR 18, 75/26 SOI SUKHUMVIT 19, NORTH KLONGTOEY, WATTHANA Bangkok",10110,0-2665-2706-8,0-2665-2705,www.polyplexthailand.com
PTT,PTT PUBLIC COMPANY LIMITED,SET,Resources,Energy & Utilities,"555 VIBHAVADI RANGSIT ROAD, CHATUCHAK Bangkok",10900,0-2537-2000,0-2537-3498-9,http://www.pttplc.com
PTTEP,PTT EXPLORATION AND PRODUCTION PUBLIC COMPANY LIMITED,SET,Resources,Energy & Utilities,"555/1 Energy Complex Building A, Floors 19-36 Vibhavadi Rangsit Road, Chatuchak Bangkok",10900,0-2537-4000,0-2537-4444,www.pttep.com
PTTGC,PTT GLOBAL CHEMICAL PUBLIC COMPANY LIMITED,SET,Industrials,Petrochemicals & Chemicals,"555/1 Energy Complex Building A, 18th Floor, Vibhavadi Rangsit Road, Chatuchak, Chatuchak Bangkok",10900,0-2265-8400,0-2265-8500,www.pttgcgroup.com
PYLON,PYLON PUBLIC COMPANY LIMITED,SET,Property & Construction,Construction Services,"252 SPE Tower, 14th Floor, Phahon Yothin Rd., Sam Sen Nai Subdistrict, Phayathai District Bangkok",10400,0-2615-1259,0-2615-1258,www.pylon.co.th
Q-CON,QUALITY CONSTRUCTION PRODUCTS PUBLIC COMPANY LIMITED,SET,Property & Construction,Construction Materials,"BANG PA-IN INDUSTRIAL ESTATE, 144 MOO 16, UDOMSORAYUTH ROAD, TAMBOL BANGKRASAN, AMPHOR BANG PA-IN Ayutthya",13160,"0-3522-1271, 0-3525-9134","0-3521-2270, 0-3522-1273",www.qcon.co.th
QDC,QUANTUM D C PUBLIC COMPANY LIMITED,mai,Agro & Food Industry,-,"TFD Building No.18 Soi Sathorn 11, yaeg 9, Khwaeng yannava, Ket Sathorn Bangkok",10120,0-2286-9959,-,https://qdc-th.listedcompany.com/home.html/page/home
QH,QUALITY HOUSES PUBLIC COMPANY LIMITED,SET,Property & Construction,Property Development,"Q.HOUSE LUMPINI BUILDING, FLOOR 7, 1 SOUTH SATHORN ROAD, TUNG MAHAMAEK, SATHON Bangkok",10120,"0-2343-8888, 0-2677-7000",-,www.qh.co.th
QHBREIT,Quality Houses Business Complex Leasehold Real Estate Investment Trust,SET,Property & Construction,Property Fund & REITs,"1 Q. House Lumpini Building 14th Floor, South Satthorn Road, Thungmahamek, Sathorn Bangkok",10120,0-2286-3484,0-2286-3585,-
QHHRREIT,Quality Houses Hotel and Residence Freehold and Leasehold Real Estate Investment Trust,SET,Property & Construction,Property Fund & REITs,"1 Q. House Lumpini Building14th Floor, South Sathon Road, Tungmahamek, Sathon Bangkok",10120,0-2286-3484,0-2286-3585,http://www.lhfund.co.th
QHOP,QUALITY HOSPITALITY LEASEHOLD PROPERTY FUND,SET,Property & Construction,Property Fund & REITs,"23A, 25 Floor, Asia Centre Building, 173/27-30, 32-33 South Sathon Road, Thungmahamek, Sathon Bangkok",10120,0-2786-2000,0-2786-2370-74,-
QLT,QUALITECH PUBLIC COMPANY LIMITED,mai,Services,-,"21/3 Banplong Road, Maptaput Sub-district, Muang District Rayong",21150,0-3869-1408-10,0-3869-2028,www.qualitechplc.com
QTC,QTC ENERGY PUBLIC COMPANY LIMITED,SET,Industrials,Industrial Materials & Machinery,"2/2 SOI KRUNGTHEP KRITHA 8 (5)., HUAMARK BANGKAPI Bangkok",10240,0-2379-3089-92,0-2379-3097,www.qtc-energy.com
QTCG,QTCG PUBLIC COMPANY LIMITED,mai,Property & Construction,-,"Soi Ramkhamhang 187 Yaek 2, Minburi Bangkok",10510,02-917-5888,-,www.qtcg.co.th
RABBIT,RABBIT HOLDINGS PUBLIC COMPANY LIMITED,SET,Property & Construction,Property Development,"No. 1000/9 BTS Visionary Park - South Tower, Unit No. 2404-2407, 24th Floor, Phahonyothin Road, Chomphon Sub-district, Chatuchak District Bangkok",10900,0-2027-8778,0-2273-8858,www.rabbitholdings.co.th
RAM,RAMKHAMHAENG HOSPITAL PUBLIC COMPANY LIMITED,SET,Services,Health Care Services,"436 RAMKHAMHAENG ROAD, HUAMARK, BANG KAPI Bangkok",10240,0-2743-9999,0-2374-0804,www.ram-hosp.co.th
RATCH,RATCH GROUP PUBLIC COMPANY LIMITED,SET,Resources,Energy & Utilities,"72 Ngam Wong Wan Road Bangkhen, Muang Nonthaburi",11000,0-2794-9999,0-2794-9998,www.ratch.co.th
RBF,R&B FOOD SUPPLY PUBLIC COMPANY LIMITED,SET,Agro & Food Industry,Food & Beverage,"9 Soi Pho Kaew 3, Yaek 17, Klongchan, Bangkapi Bangkok",10240,0-2946-6813-18,-,https://www.rbfoodsupply.co.th
RCL,REGIONAL CONTAINER LINES PUBLIC COMPANY LIMITED,SET,Services,Transportation & Logistics,"PAJATHANI TOWER,FLOOR 30, 127/35 RAJADAPISEK ROAD, YAN NAWA Bangkok",10120,"0-2296-1096, 0-2296-1093",0-2296-1098,http://www.rclgroup.com
READY,READYPLANET PUBLIC COMPANY LIMITED,mai,Technology,-,"No.51 Major Tower Rama 9 - Ramkumhang Building 17th Floor, Room No.1701-1706, Rama 9 Road, Hua Mak Sub-district, Bangkapi District Bangkok",10240,0-2016-6789,0-2016-6901,www.readyplanet.com
RICHY,RICHY PLACE 2002 PUBLIC COMPANY LIMITED,SET,Property & Construction,Property Development,"667/15 7th Floor, Attaboon Building, Charonsanitwong Road, Arunamarin Sub-district, Bangkok Noi District Bangkok",10700,0-2886-1817,0-2886-1060,www.richy.co.th
RJH,RAJTHANEE HOSPITAL PUBLIC COMPANY LIMITED,SET,Services,Health Care Services,"111 Moo 3, Rojana Road, Khlong Suan Phlu Sub-district, Phra Nakhon Si Ayutthaya District Ayutthya",13000,0-3533-5555-71,0-3533-5555 ext 878,www.rajthanee.com
