RML,RAIMON LAND PUBLIC COMPANY LIMITED,SET,Property & Construction,Property Development,"No. 548 One City Centre Building, 54th Floor, Ploenchit Road, Lumphini, Pathum Wan Bangkok",10330,0-2029-1889,0-2029-1891,www.raimonland.com
ROCK,ROCKWORTH PUBLIC COMPANY LIMITED,SET,Consumer Products,Home & Office Products,"294-300 ASOKE-DINDAENG ROAD, BANGKAPI, HUAI KHWANG Bangkok",10310,0-2123-8888,-,www.rockworth.com
ROCTEC,ROCTEC GLOBAL PUBLIC COMPANY LIMITED,SET,Technology,Information & Communication Technology,"1000/9 BTS Visionary Park - South Tower, Unit No. 1801 - 1807, 18th Floor, Phahonyothin Road, Chomphon Sub-district, Chatuchak District Bangkok",10900,0-2938-3388,0-2938-3489,https://www.roctecglobal.co.th
ROH,ROYAL ORCHID HOTEL (THAILAND) PUBLIC COMPANY LIMITED,SET,Services,Tourism & Leisure,"2 CAPTAIN BUSH LANE, NEW ROAD, BANG RAK Bangkok",10500,0-2266-0123,0-2236-6646,www.royalorchidsheraton.com
ROJNA,ROJANA INDUSTRIAL PARK PUBLIC COMPANY LIMITED,SET,Property & Construction,Property Development,"26th Floor, Italthai Tower 2034/115 New Petchburi Road Bangkapi, Huaykwang Bangkok",10310,0-2716-1750-7,0-2716-1758-9,www.rojana.com
RP,RAJA FERRY PORT PUBLIC COMPANY LIMITED,mai,Services,-,"25/1, Village No. 8, Mittraphap Road, Don Sak Sub-district, Don Sak District Surat Thani",84220,"0-7737-2800-2, 0-2277-4488","0-7737-2804, 0-2277-8521",http://www.rajaferryport.com
RPC,RPCG PUBLIC COMPANY LIMITED,SET,Resources,Energy & Utilities,"No. 86/2 Sammakorn Place, Ramkhamhaeng Road, Saphansoong Bangkok",10240,0-2372-3600,0-2372-3327,www.rpcthai.com
RPH,RATCHAPHRUEK HOSPITAL PUBLIC COMPANY LIMITED,SET,Services,Health Care Services,"456 Moo14, Mittraphap Rd., Muang Khon Kaen",40000,0-4333-3555,-,http://www.rph.co.th
RS,RS PUBLIC COMPANY LIMITED,SET,Services,Commerce,"27 RS Group Bldg., Tower A, Prasert-Manukitch Road, Sena Nikhom, Chatuchak Bangkok",10900,0-2037-8888,-,http://www.rs.co.th
RSP,RICH SPORT PUBLIC COMPANY LIMITED,SET,Services,Commerce,"1152, Punn Tower, 18th Floor, Room No. 1801 - 1805 and 1808, Rama 4 Road, Klong Toei , Klong Toei Bangkok",10110,0-2249-8709,0-2249-8711,www.richsport.co.th
RT,RIGHT TUNNELLING PUBLIC COMPANY LIMITED,SET,Property & Construction,Construction Services,"No. 292 Moo 4, Bangna-Trad (KM 26) Rd., Bangbor, Bangbor Samut Prakarn",10560,0-2313-4848,"0-2313-4849, 4787",https://www.rtco.co.th/
RWI,RAYONG WIRE INDUSTRIES PUBLIC COMPANY LIMITED,mai,Industrial,-,"Maptapud Industrial Estate, No. 5, I-5 Rd., Maptapud, Muang Rayong",21150,0-3868-4522-7,0-3868-4490,www.rwi.co.th
S,SINGHA ESTATE PUBLIC COMPANY LIMITED,SET,Property & Construction,Property Development,"No. 123 Suntowers Building B, 40th Floor, Vibhavadi-Rangsit Road, Chom Phon, Chatuchak Bangkok",10900,0-2050-5555,0-2617-6444-5,http://www.singhaestate.co.th
S&J,S & J INTERNATIONAL ENTERPRISES PUBLIC COMPANY LIMITED,SET,Consumer Products,Personal Products & Pharmaceuticals,"No. 549/2 Sathu Pradit Rd., Chong Nonsi Subdistrict, Yannawa District Bangkok",10120,0-2676-2727,0-2676-2726,www.snjinter.com
S11,S 11 GROUP PUBLIC COMPANY LIMITED,SET,Financials,Finance & Securities,"888 Soi Chatuchot 10, Chatuchot, Ao-ngoen, Sai-Mai Bangkok",10220,"0-2790-0888 , 0-2022-8888",0-2158-7948,http://www.sgroup.co.th
SA,SIAMESE ASSET PUBLIC COMPANY LIMITED,SET,Property & Construction,Property Development,"1077/48 Phahon Yothin Road, Phaya Thai Sub-districts, Phaya Thai District Bangkok",10400,"0-2617-1555, 1306",0-2617-1591,www.siameseasset.co.th
SAAM,SAAM DEVELOPMENT PUBLIC COMPANY LIMITED,mai,Resources,-,"141 Major Tower Thonglor 10th Floor, Room no. 2.2 Soi Sukhumvit 63 (Ekamai), Sukhumvit Road, Klongton Nua, Wattana Bangkok",10110,0-2096-1936-7 Ext. 105,0-2096-1936-7 Ext. 111,www.saam.co.th
SABINA,SABINA PUBLIC COMPANY LIMITED,SET,Consumer Products,Fashion,"177 Moo 8, Wangkaithurn, Hanka Chainart",17130,"0-5643-7156-8, 0-2422-9400","0-5643-7159, 0-2434-5911",www.sabina.co.th
SAF,S.A.F. SPECIAL STEEL PUBLIC COMPANY LIMITED,mai,Industrial,-,"110 Thientalay 24, Bangkhunthien-Chytalay Road, Ta-kam Sub-district, Bangkhunthien District Bangkok",10150,0-2897-4800-3,0-2897-4805,https://www.saf.co.th/
SAFE,Safe Fertility Group Public Company Limited,SET,Services,Health Care Services,"496-502 Amarin Plaza 17th Floor Ploenchit Rd., Lumpini Pathumwan Bangkok",10330,0-2252-3833,0-2252-3833,www.safefertilitygroup.com
SAK,SAKSIAM LEASING PUBLIC COMPANY LIMITED,SET,Financials,Finance & Securities,"49/47 Chetsada Bodin Road., Tha It, Muang Uttaradit Uttradit",53000,0-5544-4495,0-5544-0371,www.saksiam.com
SALEE,SALEE INDUSTRY PUBLIC COMPANY LIMITED,mai,Industrial,-,"18 MOO 10 TAMBOL KLONG SI, AMPHOE KHLONG LUANG Pathum Thani",12120,0-2529-5968-99,0-2529-5958-59,www.saleeind.com
SAM,SAMCHAI STEEL INDUSTRIES PUBLIC COMPANY LIMITED,SET,Industrials,Steel and Metal Products,"75/14,75/17, 85 MOO 5, SOI WAT SOPANARAM, EKKACHAI ROAD TAMBOL KOKKHAM, AMPHOE MUEANG Samut Sakhon",74000,0-3483-3891-3,0-3483-3895,www.samchaisteel.com
SAMART,SAMART CORPORATION PUBLIC COMPANY LIMITED,SET,Technology,Information & Communication Technology,"SOFTWARE PARK BLDG.,FL.35, 99/1 MOO 4, CHANGE WATTANA RD., AMPHOE PAK KRET Nonthaburi",11120,"0-2502-6000, 0-2975-5777",0-2502-6186,www.samartcorp.com
SAMCO,SAMMAKORN PUBLIC COMPANY LIMITED,SET,Property & Construction,Property Development,"Spring Tower Building, 21st Floor, 188 Phayathai Road, Thung Phayathai, Ratchathewi Bangkok",10400,0-2106-8300,-,www.sammakorn.co.th
SAMTEL,SAMART TELCOMS PUBLIC COMPANY LIMITED,SET,Technology,Information & Communication Technology,"SOFTWARE PARK BUILDING FLOOR 29, 99/7 MOO 4, PAK KRET Nonthaburi",11120,0-2502-6000,0-2583-8696,www.samtel.com
SANKO,SANKO DIECASTING (THAILAND) PUBLIC COMPANY LIMITED,mai,Industrial,-,"3/14 Rojana Industrial Park, Moo 2, Tambol Nong Bua, Amphur Ban Khai Rayong",21120,"0-3301-0701-5, 0-2597-9780-2",0-3301-0706-8,www.sankothai.net
SAPPE,SAPPE PUBLIC COMPANY LIMITED,SET,Agro & Food Industry,Food & Beverage,"9/3 Bang Chan Industrial Estate, Soi Seri Thai 56, Seri Thai Road, Khanna Yao Sub-district, Khanna Yao District Bangkok",10230,0-2319-4949,0-2319-7337,www.sappe.com
SAT,SOMBOON ADVANCE TECHNOLOGY PUBLIC COMPANY LIMITED,SET,Industrials,Automotive,"215 Moo 2, Debaratna Road, Tambol Bang Chalong, Amphur Bangplee Samut Prakarn",10540,0-2080-8123,0-2080-8268,www.satpcl.co.th
SAUCE,THAITHEPAROS PUBLIC COMPANY LIMITED,SET,Agro & Food Industry,Food & Beverage,"208 MOO 6, THAIBAN ROAD, THAIBAN, AMPHOE MUANG Samut Prakarn",10280,0-2703-4444,0-2387-1163,www.gmsauce.com
SAV,Samart Aviation Solutions Public Company Limited,SET,Services,Transportation & Logistics,"99/11 Moo 4 Software Park Building, Floor 25 Chaeng Wattana Road, Klong Gluar Sub-District, Pak Kret District Nonthaburi",11120,0-2502-6000,-,www.samartaviation.com
SAWAD,SRISAWAD CORPORATION PUBLIC COMPANY LIMITED,SET,Financials,Finance & Securities,"99/392 Srisawad Building, 4,6 floor, Chaeng Watthana Road, Thungsonghong, Laksi Bangkok",10210,0-2693-5555,0-2573-1565,http://www.meebaanmeerod.com
SAWANG,SAWANG EXPORT PUBLIC COMPANY LIMITED,SET,Consumer Products,Fashion,"307-307/1-4, 56, 305 SURAWONG ROAD, BANG RAK Bangkok",10500,"0-2266-5571, 0-2266-4422","0-2236-5271, 0-2237-7824",-
SC,SC ASSET CORPORATION PUBLIC COMPANY LIMITED,SET,Property & Construction,Property Development,"1010 VIPHAVADI RANGSIT ROAD, CHATUCHAK Bangkok",10900,0-2949-2000,0-2949-2134,www.scasset.com
SCAP,SRISAWAD CAPITAL 1969 PUBLIC COMPANY LIMITED,SET,Financials,Finance & Securities,"99/392 Srisawad Building, 1,5,6 floor, Chaeng Watthana Road, Thungsonghong, Laksi Bangkok",10210,0-2073-0677,0-2073-0670,www.srisawadcapital.co.th
SCB,SCB X PUBLIC COMPANY LIMITED,SET,Financials,Banking,"9 Ratchadapisek Rd., Jatujak Bangkok",10900,0-2180-8155,0-2937-7931,www.scbx.com
SCC,THE SIAM CEMENT PUBLIC COMPANY LIMITED,SET,Property & Construction,Construction Materials,"1 SIAM CEMENT ROAD, BANG SU Bangkok",10800,"0-2586-3333, 0-2586-4444","0-2587-2199, 0-2587-2201",www.scg.com
SCCC,SIAM CITY CEMENT PUBLIC COMPANY LIMITED,SET,Property & Construction,Construction Materials,"3/F, 10/F., and 12/F., Column Tower, No. 199 Ratchadapisek Road, Klongtoey Bangkok",10110,0-2797-7000,0-2797-7001-2,http://www.siamcitycement.com
SCG,RATCH PATHANA ENERGY PUBLIC COMPANY LIMITED,SET,Resources,Energy & Utilities,"636 MOO 11 SUKAPHIBAN 8 ROAD, TAMBOL NONGKHARM, AMPHOR SI RACHA Chonburi",20230,0-3848-1555,0-3848-1551,https://www.ratchpathana.com
SCGD,SCG DECOR PUBLIC COMPANY LIMITED,SET,Property & Construction,Construction Materials,"1 Siam Cement Road, Bang Su, Bang Su Bangkok",10800,"0-2586-3333,0-2586-5474",-,www.scgdecor.com
SCGP,SCG PACKAGING PUBLIC COMPANY LIMITED,SET,Industrials,Packaging,"1 Siam Cement Road, Bangsue, Bangkok",10800,0-2586-2894,0-2586-3007,www.scgpackaging.com
SCI,SCI ELECTRIC PUBLIC COMPANY LIMITED,SET,Industrials,Industrial Materials & Machinery,"107/1 Moo 1 Bangna-Trad Km.27 Road, Bangbor Samut Prakarn",10560,0-2338-1414-9,0-2708-0326-7,http://www.sci-mfgr.com
SCL,S.C.L. Motor Part Public Company Limited,mai,Industrial,-,"58-60-62-64 Chaloem Khet 3 Rd. Khwaeng Wat Thep Sirin, Pom Prap Sathu Phai District Bangkok",10100,0-2226-1909,0-2224-4122,https://www.sclmotorpart.com
SCM,SUCCESSMORE BEING PUBLIC COMPANY LIMITED,SET,Services,Commerce,"10/1-2 Ratchadapisek Road, Chatuchak Sub-District, Chatuchak District Bangkok",10900,0-2511-5955,0-2511-5944,http://www.successmore.com
SCN,SCAN INTER PUBLIC COMPANY LIMITED,SET,Resources,Energy & Utilities,"355 Bond Street, Bang Phut, Pak Kret Nonthaburi",11120,0-2503-4116-21,0-2503-4400,www.scan-inter.com
SCP,SOUTHERN CONCRETE PILE PUBLIC COMPANY LIMITED,SET,Property & Construction,Construction Materials,"SSP TOWER, FLOOR 17, 555 SUKHUMVIT 63 ROAD, NORTH KLONGTON, WATTHANA Bangkok",10110,0-2711-5134,0-2382-0351-2,www.scp.co.th
SDC,SAMART DIGITAL PUBLIC COMPANY LIMITED,SET,Technology,Information & Communication Technology,"99/2 Moo 4, Software Park, 34 Fl., Chaengwattana Rd., Klong Gluar, Pak-kred Nonthaburi",11120,0-2502-6000,0-2502-6900,www.samartdigital.com
SE,SIAMEAST SOLUTIONS PUBLIC COMPANY LIMITED,SET,Industrials,Industrial Materials & Machinery,"15/1 Highway-Rayong No.3191 Road, T. Huey-Pong, A. Muangrayong Rayong",21150,0-3868-2540,0-3868-2539,www.siameastsolutions.com
SEAFCO,SEAFCO PUBLIC COMPANY LIMITED,SET,Property & Construction,Construction Services,"144 PHAYASUREN ROAD, BANGCHAN, KHLONG SAM WA Bangkok",10510,"0-2919-3354-6, 0-2919-0090-7","0-2919-0098, 0-2518-3088",http://seafco.co.th
SEAOIL,SEA OIL PUBLIC COMPANY LIMITED,SET,Resources,Energy & Utilities,"88 Soi Bangna-Trad 30, Debaratna Road, Bangna-Tai, Bangna Bangkok",10260,0-2398-9850-1,0-2398-9852,www.seaoilthailand.com
SECURE,NFORCE SECURE PUBLIC COMPANY LIMITED,mai,Technology,-,"9/2 The Synchronized, Soi Ratchadapisek 18, Ratchadapisek Road, Huaikhwang Bangkok",10310,0-2274-0984,-,www.nforcesecure.com
SE-ED,SE-EDUCATION PUBLIC COMPANY LIMITED,SET,Services,Media & Publishing,"1858/87-90 Debaratna Road, Bangna Tai, Bangna Bangkok",10260,0-2826-8000,0-2826-8999,www.se-ed.com
SEI,"SEI MEDICAL PUBLIC CO., LTD.",mai,Consumer Products,-,"546 Ratchada One Building, Floor 7 th, Ratchadaphisek Road, ChanKasem, Chatuchak Bangkok",10900,0-2561-3691-3,0-2561-3694,www.sei.co.th
SELIC,SELIC CORP PUBLIC COMPANY LIMITED,SET,Industrials,Industrial Materials & Machinery,"270 Liapkhlongphasicharoenfangtai Road, Nongkhaem Bangkok",10160,0-2807-3347-9,0-2807-9453,http://seliccorp.com/
SENA,SENADEVELOPMENT PUBLIC COMPANY LIMITED,SET,Property & Construction,Property Development,"448 Thanyalakpark Building, Ratchadapisek 26, Khwaeng Samsen Nok, Khet Huai Khwang Bangkok",10310,02-541-4642,02-541-5164,www.sena.co.th
SENX,SEN X PUBLIC COMPANY LIMITED,mai,Property & Construction,-,"No.542, Senafest Shopping Center Building, 1 floor Charoen Nakhon Road, Khlong Ton Sai Subdistrict Khlong San District Bangkok",10600,0-2897-8888,0-2897-8822,http://www.senxgroup.com
SFLEX,STARFLEX PUBLIC COMPANY LIMITED,SET,Industrials,Packaging,"189/48-49 Moo 3, Bangprieng, Bangbo Samut Prakarn",10560,0-2708-2555,0-2708-2355,www.starflex.co.th
SFT,SHRINKFLEX (THAILAND) PUBLIC COMPANY LIMITED,mai,Industrial,-,"88/8 Moo 12, Bangpakong, Bangpakong, Chachoengsao Chacherngsao",24130,0-3808-6483,-,www.shrinkflexthailand.com
SGC,SG Capital Public Company Limited,SET,Financials,Finance & Securities,"72 NT Bangrak Tower, 20 Fl. Charoen Krung Rd. Bang Rak, Bang Rak Bangkok",10500,0-2028-2828,-,www.sgcapital.co.th
SGF,SGF CAPITAL PUBLIC COMPANY LIMITED,mai,Financials,-,"89/1 3rd Floor, Kasemsup building, Vibhavadi Rangsit Road, Chomphon, Chatuchak Bangkok",10900,0-2232-1789,0-2232-1790,www.sgfcap.com
SGP,SIAMGAS AND PETROCHEMICALS PUBLIC COMPANY LIMITED,SET,Resources,Energy & Utilities,"553 The Palladium Tower A, Floor 30, Ratchaprarop Road, Makkasan, Rajthevee Bangkok",10400,0-2120-9999,0-2250-6008,www.siamgas.com
SHANG,SHANGRI-LA HOTEL PUBLIC COMPANY LIMITED,SET,Services,Tourism & Leisure,"89 SOI WATSUANPHLU, NEW ROAD, BANG RAK Bangkok",10500,0-2236-7777,0-2236-8579,www.shangri-la.com
SHR,S HOTELS AND RESORTS PUBLIC COMPANY LIMITED,SET,Services,Tourism & Leisure,"123 Suntower Building B, 10th Floor, Vibhavadi-Rangsit Rd., Chom Phon, Chatuchack Bangkok",10900,0-2617-6467,-,http://www.shotelsresorts.com
SIAM,SIAM STEEL INTERNATIONAL PUBLIC COMPANY LIMITED,SET,Consumer Products,Home & Office Products,"51 PUCHAOSAMINGPHRAI ROAD, AMPHOE PHRA PRA DAENG, Samut Prakarn",10130,"0-2384-2876, 0-2384-3000, 0-2384-3040",0-2384-2330,http://www.siamsteel.com
SICT,SILICON CRAFT TECHNOLOGY PUBLIC COMPANY LIMITED,mai,Technology,-,"No. 40 Thetsabanrangsannua Rd., Ladyao, Chatuchak Bangkok",10900,0-2589-9991,0-2589-8881,www.sic.co.th
SIMAT,SIMAT TECHNOLOGIES PUBLIC COMPANY LIMITED,mai,Technology,-,"123/143-144 Chalongkrung Road, Lamplatew, Ladkrabang Bangkok",10520,0-2326-0999,0-2326-1666,www.simat.co.th
SINGER,SINGER THAILAND PUBLIC COMPANY LIMITED,SET,Services,Commerce,"CAT TELECOM TOWER, FLOOR 17, 72 CHAROEN KRUNG ROAD BANG RAK Bangkok",10500,0-2352-4777,0-2352-4799,www.singerthai.co.th
SINO,Sino Logistics Corporation Public Company Limited,SET,Services,Transportation & Logistics,"No. 1011 Supalai Grand Tower 7th Floor Unit 05, Rama 3 Road, Chongnonsee, Yannawa Bangkok",10120,0-2687-0477,0-2687-0486,www.sinologistics.co.th
SIRI,SANSIRI PUBLIC COMPANY LIMITED,SET,Property & Construction,Property Development,"Siri Campus Building 59 Soi Rim Khlong Phra Khanong, Phra Khanong Nuea, Vadhana Bangkok",10110,0-2027-7888,0-2109-5479,http://www.sansiri.com
SIRIPRT,Siripinyo Real Estate Investment Trust,SET,Property & Construction,Property Fund & REITs,"90 Moo 1, Soi Siam Silo, Pu Chao Saming Phrai Road, Samrong Klang Subdistrict, Phra Pradaeng District Samut Prakarn",10130,0-2183-4567,-,-
SIS,SIS DISTRIBUTION (THAILAND) PUBLIC COMPANY LIMITED,SET,Technology,Information & Communication Technology,"9 Pakin Building, 9th Floor, Room No.901, Ratchadaphisek Road, Din Daeng Bangkok",10400,0-2020-3000,0-2020-3780,www.sisthai.com
SISB,SISB PUBLIC COMPANY LIMITED,SET,Services,Professional Services,"498/12 Soi Ramkhamhaeng 39 (Tepleela 1), Wangthonglang, Wangthonglang Bangkok",10310,0-2158-9072,0-2158-9091,http://www.sisb.ac.th
SITHAI,SRITHAI SUPERWARE PUBLIC COMPANY LIMITED,SET,Industrials,Packaging,"15 Suksawat Road, Soi 36, Bangpakok, Rasburana Bangkok",10140,0-2427-0088,"0-2427-7168, 0-2428-4418",www.srithaisuperware.com
SJWD,SCGJWD LOGISTICS PUBLIC COMPANY LIMITED,SET,Services,Transportation & Logistics,"36 Krungthep Kreetha Rd., Huamark, Bangkapi Bangkok",10240,0-2710-4000,0-2710-4009,www.scgjwd.com
SK,SIRAKORN PUBLIC COMPANY LIMITED,mai,Property & Construction,-,"53/35 Village No.8, Bangkrang Sub-district, Mueng Nonthaburi Nonthaburi",11000,0-2035-7100-3,0-2035-7104-5,http://www.sirakorn.co.th
SKE,SAKOL ENERGY PUBLIC COMPANY LIMITED,SET,Resources,Energy & Utilities,"15 Moo 1, Chiang Rak Noi, Samkhok Pathum Thani",12160,0-2026-3451,0-2026-3452,www.sakolenergy.com
SKIN,SKIN LABORATORY PUBLIC COMPANY LIMITED,mai,Consumer Products,-,"89 Cosmo Office Park Building, 8th Fl., Unit P, Popular Road, Ban Mai Sub-district/Sub-area, Pak Kret District/Area Nonthaburi",11120,08-3597-9797,-,https://www.skinlabth.com
SKN,S.KIJCHAI ENTERPRISE PUBLIC COMPANY LIMITED,SET,Property & Construction,Construction Materials,"Moo 7 Huaiyang, Klaeng Rayong",21110,0-3892-8188,0-3892-8189,http://www.skn.co.th
SKR,SIKARIN PUBLIC COMPANY LIMITED,SET,Services,Health Care Services,"976 Lasalle Road, Bangnatai, Bangna Bangkok",10260,-,-,http://www.sikarin.com
SKY,SKY ICT PUBLIC COMPANY LIMITED,SET,Technology,Information & Communication Technology,"No. 55, 6-7th Floor, A.A. Capital Ratchada Building, Ratchadapisek Road, Dindaeng, Dindaeng Bangkok",10400,0-2029-7888,0-2029-7879,www.skyict.co.th
SLP,SALEE PRINTING PUBLIC COMPANY LIMITED,SET,Industrials,Packaging,"19 Moo 10, Tumbol Klong 4, Klong Luang Pathum Thani",12120,0-2529-6000,0-2529-6010-11,www.saleeprinting.com
SMART,SMART CONCRETE PUBLIC COMPANY LIMITED,mai,Property & Construction,-,"11 Moo 9. Banbueng Road, Subdistrict Nung-Irun, District Banbueng Chonburi",20220,0-3844-2500,0-3844-2521,www.smartblock.co.th
SMD100,SMD RISE PUBLIC COMPANY LIMITED,mai,Consumer Products,-,"222, 222/1-2 M.1 West Inn Complex 10 Fl. Soi - Rattanathibet Rd., Bang Rak Yai, Bang Bua Thong Nonthaburi",11110,"0-2527-8075-8, 0-2966-6467-8",0-2966-6471,www.smdrise.com
SMIT,SAHAMIT MACHINERY PUBLIC COMPANY LIMITED,SET,Industrials,Steel and Metal Products,"42, 48 SOI CHOKCHAIJONGJUMROEN, RAMA 3 ROAD, YAN NAWA Bangkok",10120,"0-2295-1000-8, 0-2295-1901-9","0-2295-1009, 0-2295-1020",www.sahamit.co.th
SMO,SMOTHONG GROUP PUBLIC COMPANY LIMITED,SET,Agro & Food Industry,Agribusiness,"119/1 Moo 10, Prasong Sub-district/Sub-area, Tha Chana District/Area Surat Thani",84170,0-7795-1470,0-7795-1471,www.smothonggroup.com
SMPC,SAHAMITR PRESSURE CONTAINER PUBLIC COMPANY LIMITED,SET,Industrials,Packaging,"92 Soi Thientalay 7 Yak 4, Bangkhunthien-Chaitalay Road, Samaedam, Bangkhunthien Bangkok",10150,"0-2895-4139-58, 0-2416-5568-9","0-2416-5534, 0-2895-4163",www.smpcplc.com
SMT,STARS MICROELECTRONICS (THAILAND) PUBLIC COMPANY LIMITED,SET,Technology,Electronic Components,"586 Moo 2, Bang Pa-In Industrial Estate, Klongjig, Bang Pa-In Ayutthya",13160,0-3525-8555,0-3522-1778,www.starsmicro.com
SNC,SNC FORMER PUBLIC COMPANY LIMITED,SET,Industrials,Industrial Materials & Machinery,"333/3 Moo 6, Bangpreang District, Amphur Bangbo Samut Prakarn",10560,"0-2108-0360-61,0-2108-0370-72",-,http://www.sncformer.com
SNNP,SRINANAPORN MARKETING PUBLIC COMPANY LIMITED,SET,Agro & Food Industry,Food & Beverage,"325/6-9 Soi Lanluang 7, Si Yaek Mahanak Sub-district, Dusit District Bangkok",10300,0-2628-0408,0-2281-5161,https://www.snnp.co.th/
SNP,S & P SYNDICATE PUBLIC COMPANY LIMITED,SET,Agro & Food Industry,Food & Beverage,"2034/100-103, 23rd Floor, Ital Thai Tower, New Petchburi Road, Bangkapi, Huaykwang Bangkok",10310,0-2785-4000,0-2785-4040,www.snpfood.com
SNPS,Specialty Natural Products Public Company Limited,SET,Consumer Products,Personal Products & Pharmaceuticals,"700/364 Moo 6, Nongmaidang Chonburi",20000,0-3845-8698,0-3845-8697,www.snpspcl.com
SO,SIAMRAJATHANEE PUBLIC COMPANY LIMITED,SET,Services,Professional Services,"329 Moo 10 Kuson Song Samakkhi Soi 1 Old Railway Road, Samrong, Phrapradaeng Samut Prakarn",10130,0-2363-9300,0-2363-9377,https://www.siamrajathanee.com/page-for-ir/
SOLAR,SOLARTRON PUBLIC COMPANY LIMITED,SET,Property & Construction,Construction Services,"77/31,32,33 Chaengwattana 15, Intersection 2, Thung Song Hong, Lak Si Bangkok",10210,0-2055-9101-3,0-2055-9104,http://www.solartron.co.th
SONIC,SONIC INTERFREIGHT PUBLIC COMPANY LIMITED,mai,Services,-,"79/349,350 1st, 2nd floor, Sathupradit Rd., Chongnonsee, Yannawa Bangkok",10120,0-2213-2999,0-2213-2533,www.sonic.co.th
SORKON,S. KHONKAEN FOODS PUBLIC COMPANY LIMITED,SET,Agro & Food Industry,Food & Beverage,"259/13 SOI PRIDI BANOMYONG 13, SUKHUMVIT 71 ROAD, WATTHANA Bangkok",10110,0-2391-1010,0-2391-1792,http://www.sorkon.co.th
SPA,SIAM WELLNESS GROUP PUBLIC COMPANY LIMITED,SET,Services,Tourism & Leisure,"565, 567 B.U. Place Building, 22nd Floor, Soi Suthiporn Prachasongkroh Road, Dindaeng Sub-district, Dindaeng District Bangkok",10400,0-2641-6619-20,0-2641-6621,http://www.siamwellnessgroup.com
SPACK,S. PACK & PRINT PUBLIC COMPANY LIMITED,SET,Industrials,Packaging,"119 MOO 1, KARNCHANAVANICH ROAD, TAMBOL TAKARM, AMPHOE HAT YAI Songkhla",90110,0-7426-0602-9,"0-7426-0600-1,0-7444-7128",www.spack.co.th
SPALI,SUPALAI PUBLIC COMPANY LIMITED,SET,Property & Construction,Property Development,"SUPALAI GRAND TOWER, 1011 RAMA 3 ROAD, CHONGNONSEE, YAN NAWA Bangkok",10120,0-2725-8888,0-2683-2177,http://www.supalai.com
SPC,SAHA PATHANAPIBUL PUBLIC COMPANY LIMITED,SET,Services,Commerce,"2156 NEW PETCHBURI ROAD, BANG KAPI, HUAI KHWANG Bangkok",10310,0-2318-0062,0-2319-1678,www.sahapat.co.th
SPCG,SPCG PUBLIC COMPANY LIMITED,SET,Resources,Energy & Utilities,"No. 1 Capital Work Place Building 10th Fl. Soi Jamjan, Klongton Nua, Wattana Bangkok",10110,0-2011-8100-10,0-2011-8112,www.spcg.co.th
SPG,THE SIAM PAN GROUP PUBLIC COMPANY LIMITED,SET,Industrials,Automotive,"488 NAKORNSAWAN ROAD, SIYAKMAHANAK, DUSIT, Bangkok",10300,0-2280-0202-17,0-2280-6305,http://www.siampangroup.com
SPI,SAHA PATHANA INTER-HOLDING PUBLIC COMPANY LIMITED,SET,Services,Commerce,"989 Rama 3 Road, Bangpongpang Sub-district, Yannawa District Bangkok",10120,0-2294-9999,-,www.spi.co.th
SPRC,STAR PETROLEUM REFINING PUBLIC COMPANY LIMITED,SET,Resources,Energy & Utilities,"No.1, I-3B Road, Map Ta Phut, Muang Rayong Rayong",21150,0-3869-9000,0-3869-9999,www.sprc.co.th
SPREME,Supreme Distribution Public Company Limited,SET,Technology,Information & Communication Technology,"No. 2/1 Soi Pradit Manutham 5, Pradit Manutham Road, Tha Raeng Sub-district, Bang Khen District Bangkok",10230,0-2943-8182,0-2943-8191,www.supreme.co.th
SPRIME,S PRIME GROWTH LEASEHOLD REAL ESTATE INVESTMENT TRUST,SET,Property & Construction,Property Fund & REITs,"No. 123 Vibhavadi Rangsit Road, 37th Floor, Suntowers B, Chom Phon Sub-District, Chatuchak District Bangkok",10900,"0-2617-6465,0-2050-5555-259",-,-
SPVI,S P V I PUBLIC COMPANY LIMITED,mai,Technology,-,"2 Premier Place Building, 1st Floor Zone A, 3rd Floor Zone A , Zone B , Soi Premier 2, Srinakarin Rd., Kwaneng Nongbon, Khet Prawet Bangkok",10250,0-2559-2901-10,0-2559-2488,http://www.spvi.co.th
SQ,SAHAKOL EQUIPMENT PUBLIC COMPANY LIMITED,SET,Property & Construction,Construction Services,47/10 Soi Amorphan 4 Vibhavadirangsit Road Chatuchak Bangkok,10900,0-2941-0888,0-2941-0881,www.sahakol.com
SR,SIAMRAJ PUBLIC COMPANY LIMITED,mai,Resources,-,"289/9 Moo10 Old Railway Road, Samrong, Phrapradaeng Samut Prakarn",10130,0-2743-5010-25,0-2743-5007-8,www.siamrajplc.com
SRICHA,SRIRACHA CONSTRUCTION PUBLIC COMPANY LIMITED,SET,Property & Construction,Construction Services,"97 Moo 3, Surasak, Sriracha Chonburi",20110,0-3831-7555,0-3831-7577,www.sricha.com
SRIPANWA,SRI PANWA HOSPITALITY REAL ESTATE INVESTMENT TRUST,SET,Property & Construction,Property Fund & REITs,"2922/198 10thFl., Charn Issara Tower II, New Petchburi Road, Bangkapi, Huay Kwang Bangkok",10310,0-2308-2022,0-2308-2022,www.cireit.com
SRS,SIRISOFT PUBLIC COMPANY LIMITED,mai,Technology,-,"89 AIA Capital Center Building, 15th Floor, Ratchadaphisek Road, Din Daeng Bangkok",10400,"0-2006-5397,0-2006-3098",-,https://www.sirisoft.co.th/
SSF,SURAPON FOODS PUBLIC COMPANY LIMITED,SET,Agro & Food Industry,Food & Beverage,"247 MOO 1, THEPARAK ROAD, THEPARAK, AMPHOE MUANG Samut Prakarn",10270,0-2385-3038-54,"0-2385-3176, 0-2385-3179",www.surapon.com
SSP,SERMSANG POWER CORPORATION PUBLIC COMPANY LIMITED,SET,Resources,Energy & Utilities,"325/14 Lanluang Rd., Mahanak Square, Dusit Bangkok",10300,0-2628-0991-2,0-2628-0993,www.sermsang.com
SSPF,SALA @ SATHORN PROPERTY FUND,SET,Property & Construction,Property Fund & REITs,"898 Ploenchit Tower, 1-2nd Floor Zone A and 12th Floor, Ploenchit Road, Lumpini, Pathumwan Bangkok",10330,0-2657-5757,-,-
SSSC,SIAM STEEL SERVICE CENTER PUBLIC COMPANY LIMITED,SET,Industrials,Steel and Metal Products,"51/3 MOO 2, PUCHAOSAMINGPHRAI ROAD, PHRA PRA DAENG Samut Prakarn",10130,"0-2385-9251-2, 0-2385-9258-66, 0-2754-5845-9","0-2385-9241, 0-2385-9253",http://www.ssscth.com
SST,SUB SRI THAI PUBLIC COMPANY LIMITED,SET,Agro & Food Industry,Food & Beverage,"206, Plaza Building, 4th Floor, Soi Pattanakarn 20, Suan Luang Sub-District, Suan Luang District Bangkok",10250,0-2318-5514-5,-,http://www.subsrithai.co.th
SSTRT,SUB SRI THAI REAL ESTATE INVESTMENT TRUST,SET,Property & Construction,Property Fund & REITs,"206, Plaza Building, 4th Floor, Soi Pattanakarn 20, Suan Luang Sub-District, Suan Luang District Bangkok",10250,0-2318-5514-5,-,www.sstrm.co.th
STA,SRI TRANG AGRO-INDUSTRY PUBLIC COMPANY LIMITED,SET,Agro & Food Industry,Agribusiness,"10 SOI 10 PETCHKASEM ROAD, HAT YAI, Songkhla",90110,0-7434-4663,"0-7434-4676, 0-7434-4677, 0-7423-7423",www.sritranggroup.com
STANLY,THAI STANLEY ELECTRIC PUBLIC COMPANY LIMITED,SET,Industrials,Automotive,"29/3 MOO 1, BANGPHUN-RANGSIT ROAD, AMPHOE MUANG Pathum Thani",12000,0-2581-5462,0-2581-5397,www.thaistanley.com
STARM,STAR MONEY PUBLIC COMPANY LIMITED,SET,Financials,Finance & Securities,"204/1-8 Sukhumwit Road, Thang Kwian, Klaeng Rayong",21110,06-1393-9988,-,www.starmoney.co.th
STC,STC CONCRETE PRODUCT PUBLIC COMPANY LIMITED,mai,Property & Construction,-,"220/26 Moo 6, Sukhumvit Road, Nakluea Sub-District, Banglamung District Chonburi",20150,0-3842-3115-6,0-3842-6519,http://www.stc.co.th/
STECH,SIAM TECHNIC CONCRETE PUBLIC COMPANY LIMITED,SET,Property & Construction,Construction Materials,"No. 50 Soi Ngam Wong Wan 47, Intersection 20, Ngam Wong Wan Road, Thungsonghong Sub-district, Laksi District Bangkok",10210,0-2589-3888,0-2589-8911,www.stec.co.th
